name,address,lat,lng,business_status,rating,user_ratings_total,types,price_level
Sekolah Dasar Bina Talenta,"Jalan Kembar Baru Utara No.4, Cigereleng",-6.939792999999999,107.612251,OPERATIONAL,4.7,18,"primary_school, school, point_of_interest, establishment",
SMA Negeri 11 Bandung,"Jalan Kembar Baru No.23, Cigereleng",-6.9406621,107.6104429,OPERATIONAL,4.6,291,"school, point_of_interest, establishment",
Firdaus children Learning Center,"Jalan Kembar Baru Barat No.7, Cigereleng",-6.9407863,107.6098557,OPERATIONAL,5,4,"school, point_of_interest, establishment",
Neverland Childcare and Learning Center,"Jalan Kembar Baru No.40, Cigereleng",-6.940016300000001,107.6096179,OPERATIONAL,4.4,7,"school, point_of_interest, establishment",
TKQ-TPQ-DTA AL MUJADDID,"Jalan Kembar Baru Utara I No.16, Cigereleng",-6.9396583,107.6111256,OPERATIONAL,Unknown,Unknown,"school, point_of_interest, establishment",
Gg. Moh Ramdhan I No 6,"Gang Muhammad Ramdan No.I, RW.6, Cigereleng",-6.9385971,107.609926,OPERATIONAL,3,1,"school, point_of_interest, establishment",
Dian Kencana Private Elementary School,Jalan BKR No.167,-6.9379665,107.6087528,OPERATIONAL,4.7,49,"primary_school, school, point_of_interest, establishment",
TK Ar'rafi,"Jalan BKR No.122, Cigereleng",-6.937602299999999,107.613686,OPERATIONAL,Unknown,Unknown,"school, point_of_interest, establishment",
