name,address,lat,lng,business_status,rating,user_ratings_total,types,price_level
Pelita Indonesia,"Jalan Cilaki No.53, Cihapit",-6.904577100000001,107.6252997,OPERATIONAL,4,1,"school, point_of_interest, establishment",
Arabesque Ballet Studio (Cilaki),"Jalan Cilaki No.3, Cihapit",-6.9070277,107.6290468,OPERATIONAL,4.5,30,"school, point_of_interest, establishment",
SDN 037 (SDPN Sabang),"Jalan Sabang No.2, Cihapit",-6.908517000000001,107.620912,OPERATIONAL,4.6,86,"primary_school, school, point_of_interest, establishment",
Rumah Belajar Daniel,"Jalan Bengawan No.69, Cihapit",-6.908946900000001,107.6270271,OPERATIONAL,4.9,64,"school, point_of_interest, establishment",
Santa Ursula Junior High School,"Yayasan Prasama Bhakti, Jalan Taman Anggrek No.1, Cihapit",-6.9110678,107.6309665,OPERATIONAL,4.8,135,"school, point_of_interest, establishment",
TK-SD PRIVATE Priangan,"Jalan Baros No.1, Cihapit",-6.9068131,107.6283367,OPERATIONAL,4.9,40,"primary_school, school, point_of_interest, establishment",
SMP Negeri 14 Bandung,"Jalan Lapangan Supratman No.8, Cihapit",-6.9082064,107.6303895,OPERATIONAL,4.7,182,"school, point_of_interest, establishment",
Santa Maria 1 Senior High School,"Jalan Bengawan No.6, Cihapit",-6.911403099999998,107.6314634,OPERATIONAL,4.6,74,"school, point_of_interest, establishment",
Home Montessori Indonesia,"Jalan Ciwulan No.26, Cihapit",-6.902128299999999,107.6254318,OPERATIONAL,4.9,11,"school, point_of_interest, establishment",
